URL,Original,Corrected
https://hinative.com/questions/23851612,Professional athletes entertain millions of people and and bring a lot of revenue to their team and the industr.,Professional athletes entertain millions of people and bring a lot of revenue to their team and the industry.
https://hinative.com/questions/23851612,Therefore they deserves the high salaries.,"Therefore, they deserve the high salaries."
https://hinative.com/questions/23843632,There is the Statue of Liberty in New York.,The Statue of Liberty is in New York.
https://hinative.com/questions/23873372,My hair so messy.,My hair is so messy.
https://hinative.com/questions/23873372,I should my hair fixed,I should get my hair done.
https://hinative.com/questions/23739420,"Dear Attendance office,","To the Attendance office,"
https://hinative.com/questions/23739420,"Emma who is in Ms. White’s class was sent  to the nurse yesterday, because she has a pink eye.","My daughter Emma, who is in Ms. White’s class, was sent  to the nurse yesterday, because she had a pink eye."
https://hinative.com/questions/23739420,"A doctor said that Emma will be able to return to school on Monday, so she won’t be at school today.","The doctor said that Emma will be able to return to school on Monday, hence she will not be at school today."
https://hinative.com/questions/23739420,"Best,","Kind regards,"
https://hinative.com/questions/23739420,Her mom,"(Emma’s mom’s full name), parent of Emma."
https://hinative.com/questions/23739420,"Emma who is in Ms. White’s class was sent to the nurse yesterday, because she has a pink eye.","Emma who is in Ms. White’s class was sent to the nurse yesterday, because she has pink eye."
https://hinative.com/questions/23739420,"A doctor said that Emma will be able to return to school on Monday, so she won’t be at school today.","The doctor said that Emma will be able to return to school on Monday, so she won’t be at school today."
https://hinative.com/questions/23739420,"Dear Attendance office,","Dear Attendance Office,"
https://hinative.com/questions/23739420,"Emma who is in Ms. White’s class was sent  to the nurse yesterday, because she has a pink eye.","Emma, who is in Ms. White’s class, was sent  to the nurse yesterday, because she has pink eye."
https://hinative.com/questions/23739420,"A doctor said that Emma will be able to return to school on Monday, so she won’t be at school today.",Her doctor said that she will be able to return to school on Monday. She cannot attend school today.
https://hinative.com/questions/23739420,"Best,","Thank you,"
https://hinative.com/questions/23739420,Her mom,Elizabeth Severide (mom)
https://hinative.com/questions/23739420,"Dear Attendance office,","To the Attendance Office,"
https://hinative.com/questions/23739420,"Emma who is in Ms. White’s class was sent to the nurse yesterday, because she has a pink eye.","Emma, who is in Ms. White’s class was sent to the nurse yesterday because she has pink eye."
https://hinative.com/questions/23739420,"A doctor said that Emma will be able to return to school on Monday, so she won’t be at school today.","Her doctor said that Emma will be able to return to school on Monday, so she won’t be at school today."
https://hinative.com/questions/23739420,"Dear Attendance office,","Dear attendance office,"
https://hinative.com/questions/23739420,"Emma who is in Ms. White’s class was sent to the nurse yesterday, because she has a pink eye.","Emma, who is in Ms. White’s class, was sent to the nurse yesterday because she has pinkeye."
https://hinative.com/questions/23739420,"A doctor said that Emma will be able to return to school on Monday, so she won’t be at school today.","A doctor said that Emma will not be able to return to school until Monday, so she won’t be at school today."
https://hinative.com/questions/23846546,"While their son was watching a comedy show and eating a snack, the parents came across an article on paper, which made them concerned.","While their son was watching a comedy show and eating a snack, the parents came across an article in the paper, which made them concerned."
https://hinative.com/questions/23846546,They had made a decision to encourage their son to exercise.,They made a decision to encourage their son to exercise.
https://hinative.com/questions/23846546,"While their son was watching a comedy show and eating a snack, the parents came across an article on paper, which made them concerned.","While their son was watching a comedy show and eating a snack, the parents came across an article in the paper, which made them concerned."
https://hinative.com/questions/23846546,They had made a decision to encourage their son to exercise.,They made a decision to encourage their son to exercise.
https://hinative.com/questions/23849484,"It’s difficult to me just has learned about 3 mouths, but I’m proud of myself.","It’s difficult to me just  because I learned for 3 mouths, but I’m proud of myself."
https://hinative.com/questions/23849484,"It’s difficult to me just has learned about 3 mouths, but I’m proud of myself.","It’s difficult to me just  because I learned for 3 mouths, but I’m proud of myself."
https://hinative.com/questions/23876596,to dream that I could,for the internship opportunity
https://hinative.com/questions/23876596,catch an internship,
https://hinative.com/questions/23876596,opportunitie in,I could get in
https://hinative.com/questions/23876596,Shenzhen during summer,Shenzhen this summer
https://hinative.com/questions/23876596,and to be,And to be
https://hinative.com/questions/23876596,"honest,I wish I could","honest, I wish I could"
https://hinative.com/questions/23876596,enjoy more the sense of,feel/have a more sense of
https://hinative.com/questions/23876596,"control over life,I wonder",control over my life. I dream
https://hinative.com/questions/23876596,that I would be a queen,to be a queen
https://hinative.com/questions/23876596,in my own kingdom!,of my own kingdom!
https://hinative.com/questions/23845160,It is very comfortbale because I can choose my favourite items being at home and choose time when they will deliver my purchases.,It is very comfortable because I can choose my favourite items being at home and choose the time when they will deliver my purchases.
https://hinative.com/questions/23845160,"This supermarket is close to my home, prices are friendly and there is a large choice of products.","This supermarket is close to my home, the prices are friendly and there is a large choice of products."
https://hinative.com/questions/23845160,There are some cashiers and the self checkouts in the grocery supermarket Kaufland.,There are some cashiers and self checkouts in Kaufland.
https://hinative.com/questions/23845160,However threre aren’t any baggers.,However there aren’t any baggers.
https://hinative.com/questions/23845160,This profession does not exist here.,There's no job for baggers here.
https://hinative.com/questions/23845160,I usually do bigger grocery shopping twice a week.,I usually do a bigger grocery shopping twice a week.
https://hinative.com/questions/23845160,I use an application and order purchases online.,I use an application and order things I need online.
https://hinative.com/questions/23845160,It is very comfortbale because I can choose my favourite items being at home and choose time when they will deliver my purchases.,It is very comfortable because I can choose my favourite items while being at home and I can also choose time when my purchase will be delivered.
https://hinative.com/questions/23845160,"If I don’t order my grocery items online, I usually go to a supermarket called Kaufland.","If I don’t order my groceries online, I usually go to a supermarket called Kaufland."
https://hinative.com/questions/23845160,"This supermarket is close to my home, prices are friendly and there is a large choice of products.","This supermarket is close to my house, prices are friendly and there is a large choice of products."
https://hinative.com/questions/23845160,There are some cashiers and the self checkouts in the grocery supermarket Kaufland.,There are some cashiers and self-checkouts at Kaufland.
https://hinative.com/questions/23845160,However threre aren’t any baggers.,However there aren’t any baggers.
https://hinative.com/questions/23845160,This profession does not exist here.,This profession doesn't exist here.
https://hinative.com/questions/23837455,I’ll let Mr. Smith know about your situation for the meeting.,I’ll let Mr. Smith know about your situation at the meeting.
https://hinative.com/questions/23859993,. suddenly I got a phone call from a company which I applied to last week.,I suddenly got a phone call from a company that I applied to last week.
https://hinative.com/questions/23859993,"she told me to do the job interview tomorrow, come to the company.",They told me to come for a job interview tomorrow at the company.
https://hinative.com/questions/23859993,You know.,"You know,"
https://hinative.com/questions/23859993,This opportunity is so important to me.,this opportunity is so important to me.
https://hinative.com/questions/23859993,It's been six months since I've looked for a job.,It's been six months since I've started looking for a job.
https://hinative.com/questions/23859993,So I think I will have to prepare it tomorrow.,So I think I will have to be prepared for tomorrow.
https://hinative.com/questions/23859993,. suddenly I got a phone call from a company which I applied to last week.,I suddenly got a phone call from a company that I applied to last week.
https://hinative.com/questions/23859993,"she told me to do the job interview tomorrow, come to the company.",They told me to come for a job interview tomorrow at the company.
https://hinative.com/questions/23859993,You know.,"You know,"
https://hinative.com/questions/23859993,This opportunity is so important to me.,this opportunity is so important to me.
https://hinative.com/questions/23859993,It's been six months since I've looked for a job.,It's been six months since I've started looking for a job.
https://hinative.com/questions/23859993,So I think I will have to prepare it tomorrow.,So I think I will have to be prepared for tomorrow.
https://hinative.com/questions/23817542,I'm going to buy some canisters for coffee beans.,
https://hinative.com/questions/23854013,"April 16,2023🍓","April 16, 2023🍓"
https://hinative.com/questions/23854013,"hello, Today I’m gonna show you this picture.","Hello, let me show you this picture from today."
https://hinative.com/questions/23854013,It’s strawberries of my garden that fruited the first this year.,They are the first strawberries from my garden that ripened this year.
https://hinative.com/questions/23854013,It rained yesterday so I skipped to go.,It rained so I did not see them yesterday.
https://hinative.com/questions/23854013,I went there this morning and found it.,I went there this morning and found the strawberries.
https://hinative.com/questions/23854013,There are only three pieces that turned to red today and it doesn’t have good shape comparing to the sold ones in grocery store’s.,"There are only three pieces that turned red today, but it doesn’t have a good shape, especially compared to the sold ones in grocery stores."
https://hinative.com/questions/23854013,"However, taste was a little sweet and good.","Though, they tasted sweet and good."
https://hinative.com/questions/23854013,"Other ones have already had some flowers as well so probably I can pick it up,even a few, every day in a row.","Other ones have already had flowers blossomed too, so I could probably harvest a few strawberries every day."
https://hinative.com/questions/23854013,I hope I could pick it as well tomorrow.,I hope I could pick more as well tomorrow.
https://hinative.com/questions/23873386,B: No matter,"B: Nothing's wrong (or just ""Nothing"")"
https://hinative.com/questions/23847007,Green forests and fresh air made me feel good.,"The green forests and fresh air felt good. (""made me feel good"" is a little weird because it sounds too straight-forward. There's nothing wrong with it grammatically though.)"
https://hinative.com/questions/23847007,I made some good tee offs and a couple of birdies.,"I had some good tee offs and a couple of birdies. (saying ""made"" just feels a little weird. It kind of sounds like you 'made' the shot into the hole.)"
https://hinative.com/questions/23847007,I played golf with friends of mine today.,I played golf with some friends of mine today.
https://hinative.com/questions/23847007,Green forests and fresh air made me feel good.,The Green forests and fresh air made me feel good.
https://hinative.com/questions/23856568,“I don’t use this tool very well and I know it might be a headache for some coworkers I don’t do my job properly.,“I don’t use this tool very well. I know I might be a headache for some coworkers because I don’t do my job properly.
https://hinative.com/questions/23856568,"I even thought about moving to other company, but I decided to stick to this project because I know I would still be of good use at some task and it will prove my reason to exist here.","I even thought about moving to another company, but I decided to stick to this project because I know I would still be of use. Staying will prove my reason to exist here."
https://hinative.com/questions/23856568,“I don’t use this tool very well and I know it might be a headache for some coworkers I don’t do my job properly.,“I don’t use this tool very well. I know I might be a headache for some coworkers because I don’t do my job properly.
https://hinative.com/questions/23856568,"I even thought about moving to other company, but I decided to stick to this project because I know I would still be of good use at some task and it will prove my reason to exist here.","I even thought about moving to another company, but I decided to stick to this project because I know I would still be of use. Staying will prove my reason to exist here."
https://hinative.com/questions/23861238,No one can doubt that South Korea has turned around nicely.,No one can doubt that South Korea has turned itself around nicely.
https://hinative.com/questions/23861238,We may be frustrated to see little progress happening over the last few years.,"We may be frustrated to see little progress happening over the last few years,"
https://hinative.com/questions/23861238,"But in the 10- to 20-year context, the changes are evident.","but in the 10- to 20-year context, the changes are clear to see."
https://hinative.com/questions/23861238,"The Social Indicators in Korea 2022, released by Statistics Korea last month, can be the testimony.","The Social Indicators in Korea 2022, released by Statistics Korea last month, is a testimony to the improvements."
https://hinative.com/questions/23861238,The biggest improvement was made in health and longevity — the basic elements of human life.,The biggest improvement was made in health and longevity — two very basic elements of human life.
https://hinative.com/questions/23861238,Average life expectancy at birth increased to 83.6 years from 76 years over the past two decades.,The average life expectancy at birth rose from 76 years to 83.6 years over the past two decades.
https://hinative.com/questions/23861238,"Men’s longevity added by more than eight years, from 72.3 to 80.6 years, and women’s nearly by seven years, from 79.7 to 86.6.","Mens' longevity increased by more than eight years; from 72.3 to 80.6 years, and womens' by nearly seven years; from 79.7 to 86.6."
https://hinative.com/questions/23861238,The numbers suggest living to be a centenarian may not be that far off.,The numbers suggest living to become a centenarian may not be that far away.
https://hinative.com/questions/23861238,Life expectancy has risen across the world.,"Life expectancy has risen across the world, but (combine with below ⬇️)"
https://hinative.com/questions/23861238,But South Koreans’ longevity has lengthened exceptionally fast over the past to live the longest life on average after the Japanese.,"South Koreans’ longevity has risen exceptionally over the past (specify time period here), to become the second longest average life expectancy, exceeded only by that of the Japanese."
https://hinative.com/questions/23861238,The fact that people live longer means that many of the medical services and living conditions have improved.,"The fact that people now live longer indicates that medical services, and living conditions, generally have improved."
https://hinative.com/questions/23861238,"Deaths from traffic accidents per 100,000 fell to 5 from 22 while the crime rate per 100,000 decreased to 2,500 cases from 4,000.","Deaths from traffic accidents fell from from 22 to 5 per 100,000, (citizens?) while the crime rate decreased from 4,000 to 2,500 cases per 100,000 (residents?) over the past (specify time frame)."
https://hinative.com/questions/23861238,The improvement for South Koreans came more constantly and faster than others thanks to the country’s staggering economic progress.,"The improvements, for South Koreans, came more constantly (consistently?) and speedily than those of other countries, thanks to South Korea's staggering economic progress."
https://hinative.com/questions/23861238,The ripples of economic advances have seeped across society to provide better living standards without a letup.,The ripples of economic advances have swept across society to provide better living standards without retreat.
https://hinative.com/questions/23861238,But we may not be able to see such dramatic progress in the future.,"Yet, we may not see such dramatic progress in the future."
https://hinative.com/questions/23861238,The younger population fueled fast growth in the economy.,"The younger population has (traditionally?) fueled fast growth in the economy, (join with below"
https://hinative.com/questions/23861238,"But in 2022, South Korea’s median age was 14 years older than the global median.","but in 2022, South Korea’s median age was 14 years older than the global median."
https://hinative.com/questions/23861238,"By 2060, their median age is expected to reach 61, which means half of the population would pass the current retirement age of 60.","By 2060, the median age is expected to reach 61, which means half of the population will hav passed the current retirement age of 60."
https://hinative.com/questions/23861238,The reading population also has fallen to 45 percent from 60 percent.,The reading population also has fallen from 60 percent to 45 percent.
https://hinative.com/questions/23861238,The number of books read by a person per year halved to 7.3.,"The number of books read by a person, per year, has halved to 7.3."
https://hinative.com/questions/23861238,Trust in others and donations to charity have fallen sharply over the last decade.,Trust in others and donations to charity have also fallen sharply over the last decade.
https://hinative.com/questions/23861238,"Respect for the opinions of others, freedom of expression and the employment rate for the disabled have improved little.","Respect for the opinions of others, freedom of expression and the employment rate for the disabled have shown little improvement."
https://hinative.com/questions/23861238,The relative happiness of Koreans against advanced nations still remains low.,The relative happiness of Koreans versus advanced nations still remains low.
https://hinative.com/questions/23861238,"Although the country has a long way to go, it is rapidly losing steam.","Although the country has a long way to go, it is now rapidly losing steam."
https://hinative.com/questions/23861238,"Frauds, perjury and false accusations in Korea were far more prevalent than in developed countries.","Frauds, perjury and false accusations in Korea were far more prevalent than in more developed countries."
https://hinative.com/questions/23861238,We must strive to stop fast deterioration in economic growth and build a social environment where people can become happier even without rapid growth.,"We must strive to stop fast deterioration in economic growth and build a social environment where people can become happier, even without rapid growth."
https://hinative.com/questions/23861238,"For the latter, public policy and system must focus more on enhancing fairness, order and trust in society.","For the latter, public policy and (which system?) system must focus more on enhancing fairness, order and trust in society."
https://hinative.com/questions/23861238,"To help Koreans sustain a good life in their longer lives and hand down a better society to future generations, more efforts must be made to enhance benevolence, strengthen social capital and build mental muscles.","To help Koreans sustain a good life during their longer lives and hand down a better society to future generations, more efforts must be made to enhance benevolence, strengthen social capital and build mental muscles."
https://hinative.com/questions/23576925,2. Let me know when and where we hang out so that you can help me with that.,2. Let me know when and where we can hang out so that you can help me with that.
https://hinative.com/questions/23576925,2. Let me know when and where we hang out so that you can help me with that.,2. Let me know when and where we can meet so you can help me with them.
https://hinative.com/questions/23858984,"Today I finished the baste for my suit, and it looked suitable on my top.","Today I finished basting the vest for my linen suit, and it looks good."
https://hinative.com/questions/23858984,Its fabric is linen.,
https://hinative.com/questions/23858984,I expect to wear it in this summer.,I expect to wear it this summer.
https://hinative.com/questions/23858984,"Today I finished the baste for my suit, and it looked suitable on my top.","Today I finished basting the vest for my linen suit, and it looks good."
https://hinative.com/questions/23858984,Its fabric is linen.,
https://hinative.com/questions/23858984,I expect to wear it in this summer.,I expect to wear it this summer.
https://hinative.com/questions/23876806,"Although I though that I would cook lunch, I found that I had already run out of eggs, so I'm on my way to a grocery.","Although I thought I would cook lunch, I found that I had already run out of eggs, so I'm on my way to a grocery store."
https://hinative.com/questions/23876806,"It's a warm fine day today, so taking a walk is good.","It's a fine warn day today, so taking a walk is good."
https://hinative.com/questions/23876479,I wonder How is some seeds that planed recently.,I planted some seeds recently. I wonder how they are doing.
https://hinative.com/questions/23876479,I can see some small cosmos's sprout.,I can see some small cosmos' sprouting.
https://hinative.com/questions/23876479,But can't see other seeds nothing.,"Unfortunately, I don’t see other seeds sprouting."
https://hinative.com/questions/23863149,I think teenagers should not avoid useing social media.,I think teenagers should not avoid using social media.
https://hinative.com/questions/23863149,Firstly It is easy for them to make a friends as well as  loves.,"First of all, it is easy for them to make friends as well as meeting potential love interests."
https://hinative.com/questions/23863149,"Because It can connect all over the world,exchange infometin If They post like their style and hobby They could meet feeling.","Because it can connect all over the world, and exchange information like their style and hobby. They could meet people who like the same things."
https://hinative.com/questions/23863149,Because I think they useing social media is good.,"Because of this, I think using social media is good."
https://hinative.com/questions/23863973,I will use the computer to complete my homework.,I'll use the computer to finish my homework.
https://hinative.com/questions/23863973,I plan on watching tv with my grandparents this weekend,I plan to watch tv with my grandparents this weekend
https://hinative.com/questions/23876880,He talked about a funny story.,He shared a funny story.
https://hinative.com/questions/23876880,That gave me a good impression.,That gave me a good impression of him.
https://hinative.com/questions/23876880,He talked about a funny story.,He shared a funny story.
https://hinative.com/questions/23876880,That gave me a good impression.,That gave me a good impression of him.
https://hinative.com/questions/23876880,He talked about a funny story.,He told a funny story.
https://hinative.com/questions/23873687,"君が""大丈夫""と言ってくれるのを待ち続けている気がする","君が""大丈夫""と言ってくれるのを待ち続けている（から前に進めない[at a standstill]）気がする"
https://hinative.com/questions/23873687,時間が解決してくれるのなら、なぜ俺は自殺するのか教えてよ,時間が解決してくれるのなら、なぜ俺は自殺する（kill myselfはこの場合、「自滅行為」を意味すると思います）のか教えてよ
https://hinative.com/questions/23873687,自慢できない性格だし、,自慢できない性格だし、（自慢できない部分もある）
https://hinative.com/questions/23873687,約束を破って出て行った,約束を破って出て行った（こともある）
https://hinative.com/questions/23873687,何日もずっと自分は愛されるに値しないって思ってた。,ずっと自分は愛されるに値しないって思った日もあった。
https://hinative.com/questions/23873687,"So think what you think, just don't call me a","So think what you think, just don't call me a (???)"
