URL,Original,Corrected
https://hinative.com/questions/23673143,1. The older is 8 and the younger is 1.,1. The older one is 8 and the younger one is 1.
https://hinative.com/questions/23673143,2. It seems like you were latina in your prior life 😂,2. It seems like you were latina in a past life 😂
https://hinative.com/questions/23859056,How do you know when to call your doctor about possible coronavirus?,How do you know when to call your doctor about possibly having coronavirus?
https://hinative.com/questions/23859056,How do you know when to call your doctor about possible coronavirus?,How can you determine when it's necessary to call your doctor about a potential COVID-19 infection?
https://hinative.com/questions/23859056,How do you know when to call your doctor about possible coronavirus?,How do you know when to call your doctor about a possible coronavirus infection?
https://hinative.com/questions/23872751,I'm not that kind of a person,I'm not that kind of person
https://hinative.com/questions/23872629,"An airplane or you can also call it a plane is an air vehicle, which can fly.","An airplane, or you can also call it a plane, is an air vehicle, which can fly."
https://hinative.com/questions/23872629,"To get on ( or ride on?) the airplane, you must go to the airport and show your passport to get on the plane.","To board (and then, fly on) the airplane, you must go to the airport and show your passport to get on the plane."
https://hinative.com/questions/23872629,"An airplane or you can also call it a plane is an air vehicle, which can fly.","An airplane, also known as a plane, is an air vehicle that can fly."
https://hinative.com/questions/23872629,"To get on ( or ride on?) the airplane, you must go to the airport and show your passport to get on the plane.",To get on an airplane you must go to the airport and show your passport.
https://hinative.com/questions/23872457,1. I will saw you the process of getting insulin injections step by step.,1. I will walk you through the process of getting insulin injections step by step.
https://hinative.com/questions/23872457,2. I will saw you how to get injections step by step.,2. I will walk you through how to get injections step by step.
https://hinative.com/questions/23872457,1. I will saw you the process of getting insulin injections step by step.,1. I will walk you through the process of getting insulin injections step by step.
https://hinative.com/questions/23872457,2. I will saw you how to get injections step by step.,2. I will walk you through how to get injections step by step.
https://hinative.com/questions/23872457,1. I will saw you the process of getting insulin injections step by step.,1. I will show you the process of getting insulin injections step by step.
https://hinative.com/questions/23872457,2. I will saw you how to get injections step by step.,"2. I will show you how to get an injection, step by step."
https://hinative.com/questions/23872443,"‎‎In the past time, many people thought people should have children, but nowadays, the thought has changed.","‎‎In the past, many people thought that people should have children, but nowadays, attitudes have changed."
https://hinative.com/questions/23872443,"We should respect each person's decision, so if someone don't want to have children, he/she doesn't have to have children.","We should respect each person's decision, so if someone don't want to have children, he/she doesn't have to have children."
https://hinative.com/questions/23872443,We have no right to interfere with their decision each other.,We have no right to interfere with their decisions.
https://hinative.com/questions/23872377,It is supposed to be for over 65age,It’s supposed to be for over 65.
https://hinative.com/questions/23872377,It is supposed to be for over 65age,It’s supposed to be for over 65.
https://hinative.com/questions/23872363,Standards in health care have improved than before,"Standards in health care have improved.

or

Standards in health care are higher than before."
https://hinative.com/questions/23872363,Standards in health care have improved than before,Standards in healthcare are better than before.
https://hinative.com/questions/23872302,"This morning it was raining so heavy, I took this opportunity to arrange the special sale for our rain items like raincoats and umbrellas in our online store.","This morning it was raining so heavy, I took this opportunity to arrange a special sale for our rain items like raincoats and umbrellas in our online store."
https://hinative.com/questions/23872262,No sooner had I sat back than I was called me to cash register.,"No sooner had I sat down, I was called back to the cash register."
https://hinative.com/questions/23872219,Get on the airplane.,Get ON the plane.
https://hinative.com/questions/23872219,Get in the airplane.,Get ON the plane
https://hinative.com/questions/23872245,“Bluetooth connection breaks time to time.,My bluetooth loses (or drops) its connection from time to time.
https://hinative.com/questions/23872245,My bluetooth mouse doesn’t move from time to time.,My bluetooth mouse stops moving from time to time.
https://hinative.com/questions/23872245,“Bluetooth connection breaks time to time.,The Bluetooth connection breaks from time to time or The Bluetooth connection sometimes breaks.
https://hinative.com/questions/23872245,“Bluetooth connection breaks time to time.,My bluetooth loses (or drops) its connection from time to time.
https://hinative.com/questions/23872245,My bluetooth mouse doesn’t move from time to time.,My bluetooth mouse stops moving from time to time.
https://hinative.com/questions/23872154,I'm going to visit my client's office afternoon.,I'm going to visit my client's office this afternoon.
https://hinative.com/questions/23872154,"I'm totally get used of working from home, so it's feeling bothering.","I'm (totally) / I've gotten used to working from home, so it's bothersome / it's bothering me (a bit) ."
https://hinative.com/questions/23872159,1. I have heard anaphylaxis.,1. I have heard OF anaphylaxis.
https://hinative.com/questions/23872159,2. Have you ever heard anaphylaxis?,2. Have you ever heard OF anaphylaxis?
https://hinative.com/questions/23872159,1. I have heard anaphylaxis.,1. I have heard of anaphylaxis.
https://hinative.com/questions/23872159,2. Have you ever heard anaphylaxis?,2. Have you ever heard of anaphylaxis?
https://hinative.com/questions/23872150,It’s just only ¥100!,It’s just/only ¥100!
https://hinative.com/questions/23872150,It’s cheep.,It’s cheap.
https://hinative.com/questions/23872058,When I went outside I saw a dog barking to a cat.,When I went outside I saw a dog barking at a cat.
https://hinative.com/questions/23872039,"I’ll support my daughter to become whatever she wants to be, but there is only one condition, which is to decide by herself.","I’ll support my daughter to become whatever she wants to be, with only one condition, which is to decide for herself what she wants."
https://hinative.com/questions/23871902,Hearing this from him made me realize that I should be grateful for just having a job and getting paid.,"Having heard this from him/After learning this, I realized that I should grateful that I have a job that pays me well/I should be grateful that I still have a job that pays me."
https://hinative.com/questions/23857083,We would like to know what kind of information and media overseas customers refer to when traveling in Japan.,We would like to know what kind of information and media overseas customers refer to when planning their travels to Japan.
https://hinative.com/questions/23842459,"Yesterday, I watched comedy videos at office while eating, and laughed out alone.","Yesterday, I watched comedy videos at the office while eating and laughed out loud."
https://hinative.com/questions/23842459,And my colleagues saw me and had a puzzled looking face.,My colleagues saw me and had a puzzled look on their face.
https://hinative.com/questions/23871726,Water is coming out from the bottle.,This sentence is not used.
https://hinative.com/questions/23871726,Water comes out from the bottle.,This one also is not used.
https://hinative.com/questions/23871704,There are a lots of language around world.,"There are many languages spoken around the world.
There are a lot of languages spoken around the world.
There are lots of languages spoken around the world."
https://hinative.com/questions/23871704,There are a lots of language around world.,There are a lot of languages around world.
https://hinative.com/questions/23871704,There are a lots of language around world.,There are lots of languages around the world.
https://hinative.com/questions/23871704,There are a lots of language around world.,"There are many languages spoken around the world.
There are a lot of languages spoken around the world.
There are lots of languages spoken around the world."
https://hinative.com/questions/23871645,Dear my car,"Dear car,"
https://hinative.com/questions/23871645,Dear my car,My dear car
https://hinative.com/questions/23871637,They have pessmistic outlook on their future.,They have a pessmistic outlook on their future.
https://hinative.com/questions/23871605,"Personally, I think it’s not different during my holiday.","Personally, I don't think it's different during my holiday."
https://hinative.com/questions/23871605,I currently put a lot of time into thinking that the balance between work and life is vague and I tried to intend to do this.,I currently put a lot of time into thinking that the balance between work and life is vague and I intended to do this.
https://hinative.com/questions/23871605,Because I love my life and the way I work these days.,"Because I enjoy (not wrong, just a better word choice in my opinion) my life and the way I work these days."
https://hinative.com/questions/23871605,"Usually during my holiday, I tried to make my routine stronger more than ever.","Usually during my holiday, I tried to make my routine more strong than ever."
https://hinative.com/questions/23871605,I made resolution lists for myself this year.,I made resolution lists for myself this year. (woohoo good job!)
https://hinative.com/questions/23871605,One of the resolutions is that working out regularly and eating healthy diet a lot.,One of the resolutions is that working out regularly and eating a healthy diet.
https://hinative.com/questions/23871605,"Still, I keep doing my routine so far and I am very proud of myself.","Still, I keep doing my routine so far and I am very proud of myself. (me too!)"
https://hinative.com/questions/23871605,One thing that I want to put new routine into the morning is “miracle waking up”.,One thing that I want to make a new routine in the morning is “miracle waking up”.
https://hinative.com/questions/23871605,"Today, I woke up at 5:30 a.m., do meditation and work out in my room to build my muscles.","Today, I woke up at 5:30 a.m., did meditation and worked out in my room to build my muscles. (💪😎)"
https://hinative.com/questions/23871605,"So before going to the place that I work, I usually do two kinds of meditation like listening to singing bowl music and shower, and do two kinds of work out like cardiovascular for walking and muscle exercise.","So before going to the place that I work, I usually do two kinds of meditation: listening to singing bowl music, shower, and do two kinds of work out like cardiovascular for walking and muscle exercise."
https://hinative.com/questions/23871605,"Anyway, making a habit is really good point for my life in the long term perspective.","Anyway, making habits is really good for my life in the long term perspective."
https://hinative.com/questions/23871605,So I want to put more routines in my life.,"So, I want to put more routines in my life."
https://hinative.com/questions/23871605,"The next plan for my daily routine is reading books in Korean and English, investing stocks, buying real state and studying English and French.","The next plan for my daily routine is reading books in Korean and English, investing stocks, buying real state, and studying English and French."
https://hinative.com/questions/23871479,I wish to happen same with my last night dream.,I wish to have the same dream as the one I had last night.
https://hinative.com/questions/23871422,“I’ve just decided to let my dream of a English teacher go.,“I’ve just decided to let my dream of being an English teacher go.
https://hinative.com/questions/23871422,"Last Sunday, I did my first class as an self-called English teacher.","Last Sunday, I did my first class as a self-appointed English teacher."
https://hinative.com/questions/23871422,"Anyway, I’m not going to pursue it anymore and will find something else to do, which is more suited for me.","Anyway, I’m not going to pursue it anymore and will find something else to do that is better suited to me."
https://hinative.com/questions/23871422,“I’ve just decided to let my dream of a English teacher go.,“I’ve just decided to let my dream of being an English teacher go.
https://hinative.com/questions/23871422,"Last Sunday, I did my first class as an self-called English teacher.","Last Sunday, I did my first class as a self-appointed English teacher."
https://hinative.com/questions/23871422,"Anyway, I’m not going to pursue it anymore and will find something else to do, which is more suited for me.","Anyway, I’m not going to pursue it anymore and will find something else to do that is better suited to me."
https://hinative.com/questions/23871422,“I’ve just decided to let my dream of a English teacher go.,I’ve just decided to let my dream of being an English teacher go.
https://hinative.com/questions/23871422,"Last Sunday, I did my first class as an self-called English teacher.","Last Sunday, I did my first class as a self-styled (or self-proclaimed) English teacher."
https://hinative.com/questions/23871422,"There were 4 students, but it wasn’t as fun as I had dreamed of.","There were 4 students, but it wasn’t as much fun as I had dreamt it would be."
https://hinative.com/questions/23871422,"Anyway, I’m not going to pursue it anymore and will find something else to do, which is more suited for me.","Anyway, I’m not going to pursue it any longer and will find something else better suited to me."
https://hinative.com/questions/23871419,A: Jack doesn’t seem to be sorry at all.,A: Jack doesn’t seem sorry at all.
https://hinative.com/questions/23871419,He’s such a selfish guy.,He’s so selfish.
https://hinative.com/questions/23871418,"A: If you’re too stressed at work at the moment, why don’t you look for a new job?","A: If you’re too stressed with work at the moment, why don’t you look for a new job?"
https://hinative.com/questions/23871418,B: I’ve already tried it.,B: I’ve already tried.
https://hinative.com/questions/23871375,“Can I ask further question?”,“Can I ask another question?”
https://hinative.com/questions/23871375,“Can I ask further question?”,“Can I ask another question?”
https://hinative.com/questions/23871375,“Can I ask further question?”,“Can I ask another question?”
https://hinative.com/questions/23871368,When did it start as national holiday,When did it (start being/become) a national holiday?
https://hinative.com/questions/23871364,1. What is the people who believe catholic called?,1. What is a person who believes in the Catholic Church called?
https://hinative.com/questions/23871362,• Natural calls.,• Nature calls.
https://hinative.com/questions/23871362,• Natural's calling me.,• Nature’s calling me.
https://hinative.com/questions/23871362,• Big one?,• The big one?
https://hinative.com/questions/23871362,(Or small one?),(Or the small one?)
https://hinative.com/questions/23871362,• I just go to pee.,• I just went to pee.
https://hinative.com/questions/23871348,“I don’t like to sit on where somebody else has just sit on and left. I will sit there which has been empty.”,I don’t like to sit where somebody else just was. I’ll sit where it’s been empty.
https://hinative.com/questions/23871348,“I don’t like to sit on where somebody else has just sit on and left. I will sit there which has been empty.”,I don’t like to sit where somebody else just was. I’ll sit where it’s been empty.
https://hinative.com/questions/23871342,“I think I order it wrong.,“I think I ordered it wrong.
https://hinative.com/questions/23871342,“I think I order it wrong.,“I think I ordered it wrong.
https://hinative.com/questions/23871342,“I think I order it wrong.,“I think I ordered it wrong.
https://hinative.com/questions/23871335,"This movement is due to the thinness and delicate nature of the flakes, which respond to heat and steam.","This movement is due to the thinness and delicate nature of the flakes, which react to heat and steam."
https://hinative.com/questions/23871335,"As the steam rises from the hot food, it causes the lightweight flakes to lift and curl, creating the illusion of movement.","As the steam rises from the hot food, it causes the lightweight flakes to lift and curl, creating the illusion of life."
https://hinative.com/questions/23871320,This graph chart shows each five countries shares of expenditure for 5 major categories,This graph chart shows each of the five countries' (not sure about this one) shares of expenditure for five major categories.
https://hinative.com/questions/23871320,"These categories are included with necessities such as cloth, housing, food , healthcare and transportation","These categories are included with necessities such as cloth, housing, food, healthcare, and transportation."
https://hinative.com/questions/23871320,"Among the all categories(Of the all categories), the housing is accounted for substantially large Portion for the countries","Among all the categories, the housing is accounted for a substantially large portion for the countries."
https://hinative.com/questions/23871320,All countries have largest proportion for housing,All countries have largest proportion for housing.
https://hinative.com/questions/23871320,Where ass the healthcare and closing are relatively lower than other categories,Where as (HAHAHA THIS CAUGHT ME OFF GUARD) the healthcare and closing are relatively lower than other categories. (ass is a swear word)
https://hinative.com/questions/23871320,"Given the information in this chart, expenditure on housing ranges from a high of 26% to a low of  22% which is very minor Difference","Given the information in this chart, expenditure on housing ranges from a high of 26% to a low of  22%, which is very minor difference."
https://hinative.com/questions/23871320,"On the other hand, expenditure on food has a wide range in those countries","On the other hand, expenditure on food has a wide range in those countries."
https://hinative.com/questions/23871248,I got a presant that some sweets in box.,I got a present that has some sweets in box.
https://hinative.com/questions/23871248,I decided to eat it one a day.,I decided to eat one of them a day.
https://hinative.com/questions/23871248,I can enjoy 8days with it.,I can enjoy 8 days with it.
https://hinative.com/questions/23871241,Japanese people will spend money 1.7 times for the Golden Week compared to that of last year.,This year Japanese people will spend 1.7 times more for/during Golden Week compared to last year.
https://hinative.com/questions/23871241,"According to a private research company, the budget is 27,870 yen per person during the Golden Week.","According to a private research company, the budget is 27,870 yen per person during Golden Week."
https://hinative.com/questions/23871241,"The research company analyses that people will be more active and they will go outside more such as travels, shopping and going restaurants rather than staying home.","The research company's analysis indicates that people will be more active and will go out more for such things as travel, shopping and eating, rather than staying home."
https://hinative.com/questions/23871173,I didn’t bother shopping yesterday.,I didn’t feel like shopping yesterday.
https://hinative.com/questions/23871128,Can we take a road trip to Hokkaido?,Can we go on a road trip to Hokkaido?
https://hinative.com/questions/23871128,Can we take a road trip to Hokkaido?,Can we go on a road trip to Hokkaido?
https://hinative.com/questions/23871128,Can we take a road trip to Hokkaido?,How about we take a road trip to Hokkaido?
https://hinative.com/questions/23871032,I like a person who have a sweet smile.,I like a person who has a sweet smile.
https://hinative.com/questions/23871032,The sweet smile is able to make warm for conversation pertoner's hart.,The sweet smile is able to make the person they’re talking to’s heart warm.
https://hinative.com/questions/23871032,"Even though, that is truly difficult thing but I try to make a smile.","Even though that is truly difficult thing, I try to have that smile."
https://hinative.com/questions/23870834,What is the maximum number of people that can ride a tricycle?,What is the maximum number of people that a tricycle can carry?
https://hinative.com/questions/23870831,"Nowadays, more and more people get married later than before.","Nowadays, more and more people are getting married later than before."
https://hinative.com/questions/23870831,"Many people get married when they are more than 35 years old but actually for women, the older they are, the harder they get pregnant.","Many people are getting married after they turn 35, but for women, the older they are, the harder it is for them to get pregnant."
https://hinative.com/questions/23870831,"So, freezing egg has become more and more popular in my country.","So, the freezing of eggs has become more and more popular in my country."
https://hinative.com/questions/23870831,But this treatment is very expensive and it's vert painful for their bodies.,But this treatment is very expensive and very painful.
https://hinative.com/questions/23870831,I just feel sorry for women receiving the treatment.,I just feel sorry for the women who get the treatment done.
https://hinative.com/questions/23870828,"No, I wouldn't.","No, I wouldn’t because we are still required to wear masks on transportation. So when getting inside, we have to take our masks off, which will take some time, I think."
https://hinative.com/questions/23870749,"I had to wait in a line, and there was a girl with her girlfriend.","I had to wait in a line, and a girl was there with her girlfriend."
https://hinative.com/questions/23870749,One of them had a similar short hairstyle as mine.,One of them had a short hairstyle similar to mine.
https://hinative.com/questions/23870797,1. I'm going to get a colonoscopy and they said that they will put my under.,1. I'm going to get a colonoscopy and they said that they will put me under.
https://hinative.com/questions/23870797,2. I'm going to get a colonoscopy and they said that they will put my under anesthesia.,2. I'm going to get a colonoscopy and they said that they will put me under anesthesia.
https://hinative.com/questions/23870550,👦: I believe we'll meet again this Sunday in the park.,👦:Can we meet again this Sunday in the park?
https://hinative.com/questions/23870550,👦: I believe we'll meet again this Sunday in the park.,👦Shall we meet again this Sunday in the park?
https://hinative.com/questions/23870550,👦: I believe we'll meet again this Sunday in the park.,👦: I hope we'll meet again this Sunday at the park.
https://hinative.com/questions/23870493,👦: I bet he doesn’t come.,👦: I bet he won’t come.
https://hinative.com/questions/23870485,Many people are looking forward to realization of gender-equality.,Many people are looking forward to the realization of gender equality.
https://hinative.com/questions/23870478,Because I'm afraid if we can communicate.,Because I'm afraid we wouldn’t be able to communicate.
https://hinative.com/questions/23870478,"And if he/she was a introverted person, I would have a hard time getting along.","And if he/she was an introverted person, I would have a hard time getting along with them."
https://hinative.com/questions/23870475,How about we go to the bar?,"""How about we go to the bar?"""
https://hinative.com/questions/23870475,Sounds good said my bro.,"""Sounds good,"" said my bro."
https://hinative.com/questions/23870427,"What I learned from my new company is so called famous company in genaral is not the company is so excellent, it is always because of excellent talent people inside and makes company become excellent.","I learned that my new company, which is a famous company, is not an excellent company in and of itself. It's an excellent company because of the talented people within it."
https://hinative.com/questions/23870427,"So, the fact is people always judge people from the education backgrouod and company name, actually is nonsence，because the realy good are the people inside not the company.","So, the fact that people are judged by their educational background and their company's name is ridiculous because it is the people themselves that make the company great."
https://hinative.com/questions/23870427,"I noticed I can have a lot of role modle in this company, no matter how excellent you are is not important than what good task that compay will assign you.","I have found that there are a lot of role models in this company. The importance is placed not on your own excellence, but on the excellence of the task that's assigned to you."
